unknown_id,area,description,why_unknown,needed_evidence,priority,next_action
U-001,packet_export,Exact frame boundary and byte order around 0x5A7F,static traces show adjacency but not serialized bytes,bench packet capture aligned with call path,high,run PKT-01..PKT-07; prioritize PKT-01/PKT-02/PKT-07
U-002,output_action,Physical meaning of XDATA[DPTR]=0x04,write is visible but target channel semantics are not,bench mapping from write timing to external output,high,"run OA-02/OA-03/OA-06 first, then OA-01..OA-08 full set"
U-003,enum_state_values,Per-value operational meaning across modules,current evidence mixes branch labels and inferred meaning,controlled scenario replay with XDATA watch,high,run ENUM-01..ENUM-10; prioritize ENUM-02 and ENUM-05
U-004,MUP_handler,Exclusive MUP handler function identity,shared dispatch chain dominates evidence,slot-isolated traces + dynamic correlation,medium,run MOD-01/MOD-02/MOD-05 with X06-isolated configuration
U-005,PVK_handler,PVK-specific handler attribution,screen evidence present but code signature still broad,targeted static deep trace around PVK-related calls,medium,run MOD-03/MOD-04/MOD-06 with X07-isolated configuration
U-006,physical_output_semantics,Whether paths correspond to valve/siren/GOA/MVK classes,no direct hardware confirmation,external IO captures with synchronized firmware events,high,run OA-06 + synchronized IO capture and safe dummy loads
