unknown_id,area,old_status,new_status,static_evidence_added,remaining_gap,next_static_step,next_doc_step,next_bench_step
PU-001,RS-485_format,partial_static_narrowing,micro_narrowed_bridge_vs_builder,0x5A7F appears bridge/resolver with caller-side MOVX evidence,exact frame byte layout,expand 0x497A/0x737C byte loops,sync docs with packet hypothesis,bench packet capture
PU-002,RS-485_address_map,unresolved,partial_static_narrowing,0x920C chain context refined; no explicit 90CYE01/02/03/04 map constant,address table unresolved,scan code/data tables near 0x920C/0x53E6,document address-map candidates,bus sniff with addressed frames
PU-003,RS-485_baud,unresolved,partial_static_narrowing,0x920C classified as service worker; divisor-like constants not proven,baud divisor constant unresolved,trace UART init windows,track baud hypotheses,scope UART timing
PU-004,CRC_checksum,unresolved,partial_static_narrowing,no strong checksum arithmetic loop in 0x5A7F micro window,CRC/checksum algorithm unknown,target arithmetic loops adjacent to packet writers,update checksum candidate ledger,inject malformed frame tests
PU-006,enum_delay,partial_static_narrowing,micro_narrowed,0x6833/0x597F/0x7922 ordering strengthened; 0x04 marker observed,numeric enum codes still ambiguous,extract more compare immediates,map enum labels conservatively,state transition bench capture
PU-009,launch_pulse,unresolved,partial_static_narrowing,0x6833->0x7DC2 path refined,pulse width constant unresolved,search timer blocks post-0x7DC2,document pulse hypotheses,measure GOA pulse duration
PU-010,damper_terminal_object_map,partial_static_narrowing,micro_narrowed,0x673C status updater branch separation strengthened,terminal/object exact mapping unknown,trace 0x3104-shifted paths,extend valve map docs,limit-switch/terminal probe
PU-011,GOA_terminal_output_map,partial_static_narrowing,micro_narrowed,warning-vs-launch split at 0x7DC2 remains candidate only,AN/AU/AO/GOA terminal mapping unresolved,separate output classes by write targets,update output map tables,bench channel mapping
